{"schema_version":"1.2","generated_at":"2026-07-14T18:02:02+08:00","timezone":"Asia/Shanghai","window_hours":24,"pipeline":{"source_store":"data/sources.json","facts_required":true,"citation_validation":"passed"},"source_status":[{"platform":"Runtime RSS endpoints","status":"not_checked","item_count":0,"checked_at":null,"error":"GitHub connector runtime could not directly execute RSS requests; browser search fallback completed and the validated cache was selectively retained."},{"platform":"Browser search fallback","status":"ok","item_count":5,"checked_at":"2026-07-14T18:02:02+08:00","error":null}],"cleanup":{"last_run_at":"2026-07-13T23:01:37+08:00","status":"completed","mode":"archive_then_expire","last_archive_at":"2026-07-13T23:01:37+08:00"},"feed":"variety","items":[{"id":"20260714-1ed8d9aaf78a78cb","topic":"Jimmy Fallon与Seth Meyers继续暑期晚间节目播出","summary":"据 Variety 报道，Jimmy Fallon 与 Seth Meyers 将在美国电视暑期淡季继续播出晚间节目。","category":"variety","language":"zh-CN","region":"GLOBAL","hot_score":72,"heat_signals":{"independent_source_count":1,"official_source_count":0,"cross_platform_count":1,"best_rank":null,"spread_velocity":null,"engagement":{"likes":null,"comments":null,"shares":null,"views":null}},"first_seen_at":"2026-07-13T23:20:00+08:00","last_seen_at":"2026-07-14T18:02:02+08:00","trend":{"status":"new","cross_platform_count":1},"entities":{"shows":["The Tonight Show","Late Night with Seth Meyers"],"celebrities":["Jimmy Fallon","Seth Meyers"],"organizations":["NBC","Variety"]},"content":{"overview":"据 Variety 报道，Jimmy Fallon 与 Seth Meyers 将在美国电视暑期淡季继续播出晚间节目。","key_points":["据 Variety 报道，Jimmy Fallon 与 Seth Meyers 将在电视暑期淡季继续播出晚间节目。","排名、互动量和未获来源支持的细节均未估算。"],"timeline":[{"time":"2026-07-13T23:20:00+08:00","event":"variety.com 发布相关报道。","source_ids":["S77b2d5c863e99efa9f26"]}]},"verification":{"status":"reported","level":2,"official_source_ids":[],"evidence_urls":["https://variety.com/2026/tv/news/nbc-jimmy-fallon-seth-meyers-late-night-boost-summer-tv-1236809641/"]},"source_ids":["S77b2d5c863e99efa9f26"],"sources":[{"source_id":"S77b2d5c863e99efa9f26","platform":"variety.com","source_type":"industry_media","rank":null,"heat_raw":null,"title":"NBC’s Best Chance to Boost Jimmy Fallon, Seth Meyers May Come During TV’s Slow Summer Cycle","url":"https://variety.com/2026/tv/news/nbc-jimmy-fallon-seth-meyers-late-night-boost-summer-tv-1236809641/","captured_at":"2026-07-14T18:02:02+08:00","content_hash":"sha256:5914e86bc37ca6b071ab2e8f46255ad3cb48918f47d5b91e126cc02cd5d7e0ed","content":{"mode":"summary_only","text":null,"summary":"Variety reported that Jimmy Fallon and Seth Meyers begin several weeks of summer late-night broadcasts.","excerpt":null,"language":"en","license":{"status":"unknown","name":null,"url":null},"retrieved_at":"2026-07-14T18:02:02+08:00"}}],"facts":[{"fact_id":"Fb89542c4eafae9de02","statement":"据 Variety 报道，Jimmy Fallon 与 Seth Meyers 将在电视暑期淡季继续播出晚间节目。","source_ids":["S77b2d5c863e99efa9f26"],"evidence_status":"single_source","fact_type":"broadcast","can_use_as_fact":true}],"conflicts":[],"risk_flags":["copyright_restriction","single_source"],"media":{"images":[],"videos":[]}},{"id":"20260714-c0bcb1b71f20e853","topic":"《Dancing With the Stars: The Next Pro》首播","summary":"据 Page Six 报道，《Dancing With the Stars: The Next Pro》于 7 月 13 日在 ABC 首播，12 名参赛者竞争成为主系列的新职业舞者。","category":"variety","language":"zh-CN","region":"GLOBAL","hot_score":73,"heat_signals":{"independent_source_count":1,"official_source_count":0,"cross_platform_count":1,"best_rank":null,"spread_velocity":null,"engagement":{"likes":null,"comments":null,"shares":null,"views":null}},"first_seen_at":"2026-07-14T08:00:00+08:00","last_seen_at":"2026-07-14T18:02:02+08:00","trend":{"status":"new","cross_platform_count":1},"entities":{"shows":["Dancing With the Stars: The Next Pro"],"celebrities":["Robert Irwin","Mark Ballas","Shirley Ballas"],"organizations":["ABC","Page Six"]},"content":{"overview":"据 Page Six 报道，《Dancing With the Stars: The Next Pro》于 7 月 13 日在 ABC 首播，12 名参赛者竞争成为主系列的新职业舞者。","key_points":["据 Page Six 报道，《Dancing With the Stars: The Next Pro》于 7 月 13 日在 ABC 首播，并设置 12 名参赛者竞争职业席位。","排名、互动量和未获来源支持的细节均未估算。"],"timeline":[{"time":"2026-07-14T08:00:00+08:00","event":"pagesix.com 发布相关报道。","source_ids":["S8c65fc8db9f73ac029ee"]}]},"verification":{"status":"reported","level":2,"official_source_ids":[],"evidence_urls":["https://pagesix.com/2026/07/13/entertainment/how-to-watch-dancing-with-the-stars-the-next-pro-for-free/"]},"source_ids":["S8c65fc8db9f73ac029ee"],"sources":[{"source_id":"S8c65fc8db9f73ac029ee","platform":"pagesix.com","source_type":"industry_media","rank":null,"heat_raw":null,"title":"How to watch 'Dancing With the Stars: The Next Pro' for free: Time, cast","url":"https://pagesix.com/2026/07/13/entertainment/how-to-watch-dancing-with-the-stars-the-next-pro-for-free/","captured_at":"2026-07-14T18:02:02+08:00","content_hash":"sha256:19bb9b4ef7b4358ca1ede5af1b77c6009f0d9ee0402e2d2fb84c48d0a06246b2","content":{"mode":"summary_only","text":null,"summary":"Page Six reported that Dancing With the Stars: The Next Pro premiered July 13 on ABC with 12 contestants competing for a professional slot.","excerpt":null,"language":"en","license":{"status":"unknown","name":null,"url":null},"retrieved_at":"2026-07-14T18:02:02+08:00"}}],"facts":[{"fact_id":"F046702fbb6fd028553","statement":"据 Page Six 报道，《Dancing With the Stars: The Next Pro》于 7 月 13 日在 ABC 首播，并设置 12 名参赛者竞争职业席位。","source_ids":["S8c65fc8db9f73ac029ee"],"evidence_status":"single_source","fact_type":"broadcast","can_use_as_fact":true}],"conflicts":[],"risk_flags":["copyright_restriction","single_source"],"media":{"images":[],"videos":[]}}]}