{"schema_version":"1.2","generated_at":"2026-07-14T12:00:11+08:00","timezone":"Asia/Shanghai","window_hours":24,"pipeline":{"source_store":"data/sources.json","facts_required":true,"citation_validation":"passed"},"source_status":[{"platform":"Runtime RSS endpoints","status":"not_checked","item_count":0,"checked_at":null,"error":"Not directly executed in this connector run; previous validated feed retained within 24 hours."},{"platform":"Browser search fallback","status":"ok","item_count":2,"checked_at":"2026-07-14T12:00:11+08:00","error":null}],"cleanup":{"last_run_at":"2026-07-13T23:01:37+08:00","status":"completed","mode":"archive_then_expire","last_archive_at":"2026-07-13T23:01:37+08:00"},"feed":"drama","items":[{"id":"20260714-carrie-modern-series","topic":"《Carrie》剧集首曝现代化改编方向","summary":"People 与 Entertainment Weekly 均报道，Mike Flanagan 为 Prime Video 制作的八集《Carrie》剧集将更新至数字时代语境，并重新设计经典舞会段落。","category":"drama","language":"zh-CN","region":"GLOBAL","hot_score":78,"heat_signals":{"independent_source_count":2,"official_source_count":0,"cross_platform_count":2,"best_rank":null,"spread_velocity":null,"engagement":{"likes":null,"comments":null,"shares":null,"views":null}},"first_seen_at":"2026-07-14T10:00:00+08:00","last_seen_at":"2026-07-14T12:00:11+08:00","trend":{"status":"rising","cross_platform_count":2},"entities":{"shows":["Carrie"],"celebrities":["Mike Flanagan","Summer H. Howell","Samantha Sloyan"],"organizations":["Prime Video","People","Entertainment Weekly"]},"content":{"overview":"People 与 Entertainment Weekly 均报道，Mike Flanagan 为 Prime Video 制作的八集《Carrie》剧集将更新至数字时代语境，并重新设计经典舞会段落。","key_points":["People 与 Entertainment Weekly 均报道，《Carrie》将被改编为 Prime Video 八集剧集，采用现代数字时代背景。","未使用来源未支持的细节，排名与互动量均保留为 null。"],"timeline":[{"time":"2026-07-14T10:00:00+08:00","event":"people.com 发布相关报道。","source_ids":["S5f98c502bdeb5e364637"]},{"time":"2026-07-14T10:00:00+08:00","event":"ew.com 发布相关报道。","source_ids":["S6e7b4d8a83725e0950c0"]}]},"verification":{"status":"confirmed","level":4,"official_source_ids":[],"evidence_urls":["https://people.com/carrie-tv-show-prom-scene-completely-different-12018573","https://ew.com/carrie-tv-series-first-look-mike-flanagan-modern-twist-exclusive-12015053"]},"source_ids":["S5f98c502bdeb5e364637","S6e7b4d8a83725e0950c0"],"sources":[{"source_id":"S5f98c502bdeb5e364637","platform":"people.com","source_type":"industry_media","rank":null,"heat_raw":null,"title":"Carrie TV Series' Prom Scene Will Be Completely Different, Says Showrunner Mike Flanagan","url":"https://people.com/carrie-tv-show-prom-scene-completely-different-12018573","captured_at":"2026-07-14T12:00:11+08:00","content_hash":"sha256:efa0caa308f03a4316d8071bdc3dfc1949e0c6d9b7081d01715be6a6bd5eef46","content":{"mode":"summary_only","text":null,"summary":"People reported that Prime Video’s eight-episode Carrie series will premiere in fall 2026 and that Mike Flanagan plans a substantially reworked prom sequence.","excerpt":null,"language":"en","license":{"status":"unknown","name":null,"url":null},"retrieved_at":"2026-07-14T12:00:11+08:00"}},{"source_id":"S6e7b4d8a83725e0950c0","platform":"ew.com","source_type":"industry_media","rank":null,"heat_raw":null,"title":"Carrie exclusive first look: How Mike Flanagan gives the Stephen King classic a modern TV twist","url":"https://ew.com/carrie-tv-series-first-look-mike-flanagan-modern-twist-exclusive-12015053","captured_at":"2026-07-14T12:00:11+08:00","content_hash":"sha256:07b171fdbb97c34e75de5c2ff4c4cb94fd530e8494678f9399f9ff59da8eb77f","content":{"mode":"summary_only","text":null,"summary":"Entertainment Weekly reported that Mike Flanagan’s eight-episode Carrie series for Prime Video updates the story for the digital age and stars Summer H. Howell.","excerpt":null,"language":"en","license":{"status":"unknown","name":null,"url":null},"retrieved_at":"2026-07-14T12:00:11+08:00"}}],"facts":[{"fact_id":"F3f4abdd08d6f27be61","statement":"People 与 Entertainment Weekly 均报道，《Carrie》将被改编为 Prime Video 八集剧集，采用现代数字时代背景。","source_ids":["S5f98c502bdeb5e364637","S6e7b4d8a83725e0950c0"],"evidence_status":"cross_confirmed","fact_type":"broadcast","can_use_as_fact":true}],"conflicts":[],"risk_flags":["copyright_restriction"],"media":{"images":[],"videos":[]}}]}
